{
  "$schema": "https://json-schema.org/draft/2020-12/schema",
  "$id": "https://raw.githubusercontent.com/realactivity/scout-remote/main/contracts/schemas/response.schema.json",
  "title": "Command response (responses/{commandId}.json)",
  "description": "Bridge-to-mobile response. The first wire status is the bridge's prompt acknowledgement; the client-local draft and queued states never appear on the wire (spec Appendix A.1). A response in a terminal status is immutable; later corrections are new events referencing the original command. Spec sections 7, 15.1.",
  "type": "object",
  "additionalProperties": false,
  "required": ["schemaVersion", "commandId", "status"],
  "properties": {
    "schemaVersion": { "const": 1 },
    "commandId": { "type": "string", "pattern": "^[0-9A-HJKMNP-TV-Z]{26}$" },
    "status": {
      "type": "string",
      "enum": [
        "acknowledged",
        "running",
        "completed",
        "failed",
        "expired",
        "waiting_for_desktop_approval",
        "canceled"
      ]
    },
    "startedUtc": { "type": "string", "format": "date-time" },
    "completedUtc": { "type": "string", "format": "date-time" },
    "message": { "type": "string" },
    "attentionReason": {
      "type": "string",
      "description": "Required context when status is waiting_for_desktop_approval: exactly what the user must do on the desktop."
    },
    "artifacts": {
      "type": "array",
      "items": {
        "type": "object",
        "additionalProperties": false,
        "required": ["name", "driveItemId"],
        "properties": {
          "name": { "type": "string" },
          "driveItemId": {
            "type": "string",
            "description": "OneDrive driveItem reference; artifacts are referenced by ID, never inlined (spec 11.1)."
          }
        }
      }
    },
    "usage": {
      "type": "object",
      "additionalProperties": false,
      "properties": {
        "workIqCalls": { "type": "integer", "minimum": 0 },
        "modelTokens": { "type": ["integer", "null"], "minimum": 0 }
      }
    }
  },
  "allOf": [
    {
      "if": { "properties": { "status": { "const": "waiting_for_desktop_approval" } }, "required": ["status"] },
      "then": { "required": ["attentionReason"] }
    }
  ]
}
