{
  "schemaVersion": 1,
  "commandId": "01KZYMGHG0NPD8AF5A96MP2YFW",
  "status": "completed",
  "startedUtc": "2026-08-13T22:45:01Z",
  "completedUtc": "2026-08-13T22:46:14Z",
  "message": "Architecture review is complete. Two follow-ups remain.",
  "artifacts": [
    { "name": "architecture-review.docx", "driveItemId": "EXAMPLE-DRIVE-ITEM-ID" }
  ],
  "usage": { "workIqCalls": 0, "modelTokens": null }
}
